{
  "agent_name": "PythonRandomAgent",
  "benchmark_version": "0.1.0",
  "primary_score": 40.0,
  "reproducibility": {
    "agent_manifest_hash": "sha256:8df39d614e32cdc8c43ebbaa4bf45489d4317b61a15eb27984e2c81cf960f14e",
    "agent_manifest_path": "examples/agents/python_random_agent/agent.yaml",
    "benchmark_version": "0.1.0",
    "inputs": {
      "config": {
        "path": "configs/mvp_hunl_rollout.yaml",
        "sha256": "sha256:924a6418556f3d1f748513629c34d5f481f086d39ae191c7118e443d91f07e0f"
      },
      "seed_manifest": {
        "path": "src/pokerbench_ng/data/public_seed_manifests/hunl_100bb_mvp.example.json",
        "sha256": "sha256:afc257ce3dc56e7af32e0c7d3dffbabcaac7123350cf1a11a9885d60caaa775f"
      }
    },
    "opponent": {
      "id": "call_check",
      "name": "CallCheckBot",
      "version": "0.1.0"
    },
    "package_version": "0.1.0",
    "scoring_version": "rollout_v1",
    "seed_count": 5,
    "seed_schedule_hash": "sha256:b726eed184cea30d5a57fb645f77527e4232bec085e24e8d29a6e3b2c84c2db1"
  },
  "schema_version": "1.0",
  "summary": {
    "controlled_bb_per_100": -20.0,
    "controlled_bb_per_100_ci95": [
      -305.043576,
      265.043576
    ],
    "decisions": 14,
    "hands": 5,
    "illegal_action_rate": 0.0,
    "malformed_rate": 0.0,
    "process_error_rate": 0.0,
    "timeout_rate": 0.0,
    "total_net_bb": -1.0
  },
  "track_id": "controlled_rollout_hunl_dev"
}
