{
  "agent_name": "PythonRandomAgent",
  "benchmark_version": "0.1.0",
  "primary_score": 0.08251,
  "reproducibility": {
    "agent_manifest_hash": "sha256:8df39d614e32cdc8c43ebbaa4bf45489d4317b61a15eb27984e2c81cf960f14e",
    "agent_manifest_path": "examples/agents/python_random_agent/agent.yaml",
    "benchmark_version": "0.1.0",
    "inputs": {
      "spots": {
        "path": "src/pokerbench_ng/data/public_spots/dev.example.jsonl",
        "sha256": "sha256:aa4db2a3e51abcd746a48e05909ac1a19acaae5c57624421a335d73cffa74652"
      }
    },
    "package_version": "0.1.0",
    "scoring_version": "static_v1"
  },
  "schema_version": "1.0",
  "summary": {
    "blunder_rate": 1.0,
    "exact_action_agreement": 0.0,
    "illegal_action_rate": 0.0,
    "malformed_rate": 0.0,
    "near_best_agreement": 0.0,
    "process_error_rate": 0.0,
    "static_ev_loss_bb_per_decision": 1.42,
    "static_spots": 1,
    "timeout_rate": 0.0
  },
  "track_id": "static_hunl_dev"
}
